{"$schema":"https://json-schema.org/draft/2020-12/schema","$id":"system-e2e-run-summary-v1","type":"object","additionalProperties":false,"required":["run_id","status","asset_ids","started_at","retryable"],"properties":{"run_id":{"type":"string","minLength":1},"status":{"enum":["running","succeeded","failed","blocked","dead_lettered"]},"source_uri":{"type":["string","null"]},"source_sha256":{"type":["string","null"],"pattern":"^[a-f0-9]{64}$"},"batch_id":{"type":["string","null"]},"asset_ids":{"type":"array","items":{"type":"string"},"uniqueItems":true},"started_at":{"type":"string","format":"date-time"},"completed_at":{"type":["string","null"],"format":"date-time"},"error_code":{"type":["string","null"]},"retryable":{"type":"boolean"}}}
